[
  {
    "Name": "Common",
    "ID": "PL_Common",
    "Description": "The most widely spoken language in the world. Most human settlements speak Common, and it serves as a lingua franca for trade and diplomacy.",
    "TypeTags": {
      "GameplayTags": [
        {
          "TagName": "Language.Standard"
        }
      ],
      "ParentTags": []
    }
  },
  {
    "Name": "Elvish",
    "ID": "PL_Elvish",
    "Description": "The language of elves, known for its flowing, melodic sounds. Also called Elven.",
    "TypeTags": {
      "GameplayTags": [
        {
          "TagName": "Language.Standard"
        }
      ],
      "ParentTags": []
    }
  },
  {
    "Name": "Dwarvish",
    "ID": "PL_Dwarvish",
    "Description": "The language of dwarves, characterized by its guttural sounds and runic script. Also called Dwarven.",
    "TypeTags": {
      "GameplayTags": [
        {
          "TagName": "Language.Standard"
        }
      ],
      "ParentTags": []
    }
  },
  {
    "Name": "Halfling",
    "ID": "PL_Halfling",
    "Description": "The language of halflings, a simple and cheerful tongue.",
    "TypeTags": {
      "GameplayTags": [
        {
          "TagName": "Language.Standard"
        }
      ],
      "ParentTags": []
    }
  },
  {
    "Name": "Gnomish",
    "ID": "PL_Gnomish",
    "Description": "The language of gnomes, known for its technical vocabulary and precise grammar.",
    "TypeTags": {
      "GameplayTags": [
        {
          "TagName": "Language.Standard"
        }
      ],
      "ParentTags": []
    }
  },
  {
    "Name": "Orc",
    "ID": "PL_Orc",
    "Description": "The guttural language of orcs, used for communication among orc tribes.",
    "TypeTags": {
      "GameplayTags": [
        {
          "TagName": "Language.Standard"
        }
      ],
      "ParentTags": []
    }
  },
  {
    "Name": "Draconic",
    "ID": "PL_Draconic",
    "Description": "The language of dragons, one of the oldest languages in existence. Many scholars learn Draconic to study ancient texts.",
    "TypeTags": {
      "GameplayTags": [
        {
          "TagName": "Language.Exotic"
        }
      ],
      "ParentTags": []
    }
  },
  {
    "Name": "Infernal",
    "ID": "PL_Infernal",
    "Description": "The language of devils, used in contracts and legal documents in the Nine Hells.",
    "TypeTags": {
      "GameplayTags": [
        {
          "TagName": "Language.Exotic"
        }
      ],
      "ParentTags": []
    }
  },
  {
    "Name": "Abyssal",
    "ID": "PL_Abyssal",
    "Description": "The language of demons, a chaotic and harsh tongue spoken in the Abyss.",
    "TypeTags": {
      "GameplayTags": [
        {
          "TagName": "Language.Exotic"
        }
      ],
      "ParentTags": []
    }
  },
  {
    "Name": "Celestial",
    "ID": "PL_Celestial",
    "Description": "The language of celestials, used by angels and other divine beings.",
    "TypeTags": {
      "GameplayTags": [
        {
          "TagName": "Language.Exotic"
        }
      ],
      "ParentTags": []
    }
  },
  {
    "Name": "Deep Speech",
    "ID": "PL_DeepSpeech",
    "Description": "A language spoken by aberrations and other creatures from the Far Realm. It has no script.",
    "TypeTags": {
      "GameplayTags": [
        {
          "TagName": "Language.Exotic"
        }
      ],
      "ParentTags": []
    }
  },
  {
    "Name": "Giant",
    "ID": "PL_Giant",
    "Description": "The language of giants, used by various giant races.",
    "TypeTags": {
      "GameplayTags": [
        {
          "TagName": "Language.Standard"
        }
      ],
      "ParentTags": []
    }
  },
  {
    "Name": "Goblin",
    "ID": "PL_Goblin",
    "Description": "The language of goblins and hobgoblins.",
    "TypeTags": {
      "GameplayTags": [
        {
          "TagName": "Language.Standard"
        }
      ],
      "ParentTags": []
    }
  },
  {
    "Name": "Primordial",
    "ID": "PL_Primordial",
    "Description": "The ancient language of elementals, with four dialects: Aquan, Auran, Ignan, and Terran.",
    "TypeTags": {
      "GameplayTags": [
        {
          "TagName": "Language.Exotic"
        }
      ],
      "ParentTags": []
    }
  },
  {
    "Name": "Sylvan",
    "ID": "PL_Sylvan",
    "Description": "The language of fey creatures, spoken in the Feywild.",
    "TypeTags": {
      "GameplayTags": [
        {
          "TagName": "Language.Exotic"
        }
      ],
      "ParentTags": []
    }
  },
  {
    "Name": "Undercommon",
    "ID": "PL_Undercommon",
    "Description": "A trade language spoken in the Underdark, derived from Elvish and Dwarvish.",
    "TypeTags": {
      "GameplayTags": [
        {
          "TagName": "Language.Standard"
        }
      ],
      "ParentTags": []
    }
  }
]