[
  {
    "Name": "Fire",
    "ID": "DMG_Fire",
    "TypeTags": {
      "GameplayTags": [
        {
          "TagName": "DamageType.Fire"
        }
      ],
      "ParentTags": []
    },
    "Description": "Fire damage burns and ignites targets"
  },
  {
    "Name": "Cold",
    "ID": "DMG_Cold",
    "TypeTags": {
      "GameplayTags": [
        {
          "TagName": "DamageType.Cold"
        }
      ],
      "ParentTags": []
    },
    "Description": "Cold damage freezes and slows targets"
  },
  {
    "Name": "Lightning",
    "ID": "DMG_Lightning",
    "TypeTags": {
      "GameplayTags": [
        {
          "TagName": "DamageType.Lightning"
        }
      ],
      "ParentTags": []
    },
    "Description": "Lightning damage shocks and electrifies targets"
  },
  {
    "Name": "Poison",
    "ID": "DMG_Poison",
    "TypeTags": {
      "GameplayTags": [
        {
          "TagName": "DamageType.Poison"
        }
      ],
      "ParentTags": []
    },
    "Description": "Poison damage sickens and weakens targets"
  },
  {
    "Name": "Psychic",
    "ID": "DMG_Psychic",
    "TypeTags": {
      "GameplayTags": [
        {
          "TagName": "DamageType.Psychic"
        }
      ],
      "ParentTags": []
    },
    "Description": "Psychic damage attacks the mind and consciousness"
  },
  {
    "Name": "Radiant",
    "ID": "DMG_Radiant",
    "TypeTags": {
      "GameplayTags": [
        {
          "TagName": "DamageType.Radiant"
        }
      ],
      "ParentTags": []
    },
    "Description": "Radiant damage is pure divine or positive energy"
  },
  {
    "Name": "Necrotic",
    "ID": "DMG_Necrotic",
    "TypeTags": {
      "GameplayTags": [
        {
          "TagName": "DamageType.Necrotic"
        }
      ],
      "ParentTags": []
    },
    "Description": "Necrotic damage withers matter and even the soul"
  },
  {
    "Name": "Acid",
    "ID": "DMG_Acid",
    "TypeTags": {
      "GameplayTags": [
        {
          "TagName": "DamageType.Acid"
        }
      ],
      "ParentTags": []
    },
    "Description": "Acid damage corrodes and dissolves matter"
  },
  {
    "Name": "Force",
    "ID": "DMG_Force",
    "TypeTags": {
      "GameplayTags": [
        {
          "TagName": "DamageType.Force"
        }
      ],
      "ParentTags": []
    },
    "Description": "Force damage is pure magical energy focused into a damaging form"
  },
  {
    "Name": "Thunder",
    "ID": "DMG_Thunder",
    "TypeTags": {
      "GameplayTags": [
        {
          "TagName": "DamageType.Thunder"
        }
      ],
      "ParentTags": []
    },
    "Description": "Thunder damage is a sound-based attack that can deafen"
  }
]