[
  {
    "Name": "Fire",
    "ID": "DMG_Fire",
    "Description": "Fire damage burns and ignites targets",
    "TypeTags": {
      "GameplayTags": [
        {
          "TagName": "DamageType.Fire"
        }
      ],
      "ParentTags": []
    }
  },
  {
    "Name": "Cold",
    "ID": "DMG_Cold",
    "Description": "Cold damage freezes and slows targets",
    "TypeTags": {
      "GameplayTags": [
        {
          "TagName": "DamageType.Cold"
        }
      ],
      "ParentTags": []
    }
  },
  {
    "Name": "Lightning",
    "ID": "DMG_Lightning",
    "Description": "Lightning damage shocks and electrifies targets",
    "TypeTags": {
      "GameplayTags": [
        {
          "TagName": "DamageType.Lightning"
        }
      ],
      "ParentTags": []
    }
  },
  {
    "Name": "Poison",
    "ID": "DMG_Poison",
    "Description": "Poison damage sickens and weakens targets",
    "TypeTags": {
      "GameplayTags": [
        {
          "TagName": "DamageType.Poison"
        }
      ],
      "ParentTags": []
    }
  },
  {
    "Name": "Psychic",
    "ID": "DMG_Psychic",
    "Description": "Psychic damage attacks the mind and consciousness",
    "TypeTags": {
      "GameplayTags": [
        {
          "TagName": "DamageType.Psychic"
        }
      ],
      "ParentTags": []
    }
  },
  {
    "Name": "Radiant",
    "ID": "DMG_Radiant",
    "Description": "Radiant damage is pure divine or positive energy",
    "TypeTags": {
      "GameplayTags": [
        {
          "TagName": "DamageType.Radiant"
        }
      ],
      "ParentTags": []
    }
  },
  {
    "Name": "Necrotic",
    "ID": "DMG_Necrotic",
    "Description": "Necrotic damage withers matter and even the soul",
    "TypeTags": {
      "GameplayTags": [
        {
          "TagName": "DamageType.Necrotic"
        }
      ],
      "ParentTags": []
    }
  },
  {
    "Name": "Acid",
    "ID": "DMG_Acid",
    "Description": "Acid damage corrodes and dissolves matter",
    "TypeTags": {
      "GameplayTags": [
        {
          "TagName": "DamageType.Acid"
        }
      ],
      "ParentTags": []
    }
  },
  {
    "Name": "Force",
    "ID": "DMG_Force",
    "Description": "Force damage is pure magical energy focused into a damaging form",
    "TypeTags": {
      "GameplayTags": [
        {
          "TagName": "DamageType.Force"
        }
      ],
      "ParentTags": []
    }
  },
  {
    "Name": "Thunder",
    "ID": "DMG_Thunder",
    "Description": "Thunder damage is a sound-based attack that can deafen",
    "TypeTags": {
      "GameplayTags": [
        {
          "TagName": "DamageType.Thunder"
        }
      ],
      "ParentTags": []
    }
  },
  {
    "Name": "Slashing",
    "ID": "DMG_Slashing",
    "Description": "Slashing damage is dealt by weapons that cut or slice, such as swords, axes, and scimitars",
    "TypeTags": {
      "GameplayTags": [
        {
          "TagName": "DamageType.Slashing"
        }
      ],
      "ParentTags": []
    }
  },
  {
    "Name": "Piercing",
    "ID": "DMG_Piercing",
    "Description": "Piercing damage is dealt by weapons that stab or penetrate, such as arrows, spears, and rapiers",
    "TypeTags": {
      "GameplayTags": [
        {
          "TagName": "DamageType.Piercing"
        }
      ],
      "ParentTags": []
    }
  },
  {
    "Name": "Bludgeoning",
    "ID": "DMG_Bludgeoning",
    "Description": "Bludgeoning damage is dealt by weapons that crush or bludgeon, such as maces, clubs, and hammers",
    "TypeTags": {
      "GameplayTags": [
        {
          "TagName": "DamageType.Bludgeoning"
        }
      ],
      "ParentTags": []
    }
  }
]
